{"schema":"contraste.contract/v1","family":"balance_sheet","title":{"en":"Balance sheet","es":"Balance"},"used_by":{"en":"IRRBB and liquidity: one row per item, currency and repricing band.","es":"IRRBB y liquidez: una fila por partida, moneda y banda de reprecio."},"fields":[{"name":"as_of","kind":"date","meaning":{"en":"Balance-sheet date","es":"Fecha del balance"},"unit":"","lo":null,"hi":null,"lo_open":false,"hi_open":false,"values":[],"values_param":null,"required":true,"on_missing":"reject","expected":"an ISO date YYYY-MM-DD"},{"name":"item","kind":"str","meaning":{"en":"Balance-sheet item","es":"Partida del balance"},"unit":"","lo":null,"hi":null,"lo_open":false,"hi_open":false,"values":[],"values_param":null,"required":true,"on_missing":"reject","expected":"a non-empty text"},{"name":"currency","kind":"enum","meaning":{"en":"Currency (CLF is the UF)","es":"Moneda (CLF es la UF)"},"unit":"","lo":null,"hi":null,"lo_open":false,"hi_open":false,"values":["USD","CLP","CLF","EUR"],"values_param":null,"required":true,"on_missing":"reject","expected":"one of {USD, CLP, CLF, EUR}"},{"name":"amount","kind":"float","meaning":{"en":"Amount, assets positive and liabilities negative","es":"Monto, activos positivos y pasivos negativos"},"unit":"currency","lo":null,"hi":null,"lo_open":false,"hi_open":false,"values":[],"values_param":null,"required":true,"on_missing":"reject","expected":"a finite number in (-inf, +inf) (currency)"},{"name":"repricing_bucket","kind":"enum","meaning":{"en":"Repricing time band (SRP31.96 Table 3)","es":"Banda temporal de reprecio (SRP31.96 Tabla 3)"},"unit":"","lo":null,"hi":null,"lo_open":false,"hi_open":false,"values":["ON","ON-1M","1M-3M","3M-6M","6M-9M","9M-1Y","1Y-1.5Y","1.5Y-2Y","2Y-3Y","3Y-4Y","4Y-5Y","5Y-6Y","6Y-7Y","7Y-8Y","8Y-9Y","9Y-10Y","10Y-15Y","15Y-20Y","20Y+"],"values_param":null,"required":true,"on_missing":"reject","expected":"one of {ON, ON-1M, 1M-3M, 3M-6M, 6M-9M, 9M-1Y, 1Y-1.5Y, 1.5Y-2Y, 2Y-3Y, 3Y-4Y, 4Y-5Y, 5Y-6Y, 6Y-7Y, 7Y-8Y, 8Y-9Y, 9Y-10Y, 10Y-15Y, 15Y-20Y, 20Y+}"},{"name":"behavioural_class","kind":"enum","meaning":{"en":"Behavioural class","es":"Clase de comportamiento"},"unit":"","lo":null,"hi":null,"lo_open":false,"hi_open":false,"values":["contractual","nmd_retail_transactional","nmd_retail_non_transactional","nmd_wholesale","prepayable_fixed_rate_loan","redeemable_term_deposit"],"values_param":null,"required":true,"on_missing":"reject","expected":"one of {contractual, nmd_retail_transactional, nmd_retail_non_transactional, nmd_wholesale, prepayable_fixed_rate_loan, redeemable_term_deposit}"},{"name":"core_share","kind":"float","meaning":{"en":"Core share of a non-maturity deposit","es":"Porción estable de un depósito a la vista"},"unit":"fraction","lo":0.0,"hi":1.0,"lo_open":false,"hi_open":false,"values":[],"values_param":null,"required":false,"on_missing":"reject","expected":"a finite number in [0, 1] (fraction)"},{"name":"core_avg_maturity_years","kind":"float","meaning":{"en":"Average maturity of the core","es":"Plazo promedio de la porción estable"},"unit":"years","lo":0.0,"hi":null,"lo_open":false,"hi_open":false,"values":[],"values_param":null,"required":false,"on_missing":"reject","expected":"a finite number in [0, +inf) (years)"},{"name":"liquidity_class","kind":"enum","meaning":{"en":"Liquidity class: the HQLA level of an asset, or not HQLA (LCR30)","es":"Clase de liquidez: el nivel HQLA de un activo, o no HQLA (LCR30)"},"unit":"","lo":null,"hi":null,"lo_open":false,"hi_open":false,"values":["level_1","level_2a","level_2b","non_hqla"],"values_param":null,"required":false,"on_missing":"reject","expected":"one of {level_1, level_2a, level_2b, non_hqla}"},{"name":"residual_days","kind":"int","meaning":{"en":"Residual contractual maturity in days","es":"Plazo contractual residual en días"},"unit":"days","lo":0.0,"hi":null,"lo_open":false,"hi_open":false,"values":[],"values_param":null,"required":false,"on_missing":"reject","expected":"an integer in [0, +inf) (days)"},{"name":"insured","kind":"flag","meaning":{"en":"Insured by a deposit insurance scheme (a deposit)","es":"Asegurado por un esquema de seguro de depósitos"},"unit":"","lo":null,"hi":null,"lo_open":false,"hi_open":false,"values":[],"values_param":null,"required":false,"on_missing":"reject","expected":"0 or 1"},{"name":"fair_value","kind":"float","meaning":{"en":"Fair value beside the carrying amount, in the same sign convention as amount","es":"Valor razonable junto al monto contable, con el mismo signo que amount"},"unit":"currency","lo":null,"hi":null,"lo_open":false,"hi_open":false,"values":[],"values_param":null,"required":false,"on_missing":"reject","expected":"a finite number in (-inf, +inf) (currency)"}],"rules":[{"id":"BS-NMD-CAPS","scope":"record","policy":"flag","field":"core_share","statement":{"en":"Core non-maturity deposits respect the caps of SRP31 Table 4; above them the engine applies the cap.","es":"Los depósitos a la vista estables respetan los topes de SRP31 Tabla 4; sobre ellos el motor aplica el tope."},"group_by":[],"order_by":null}],"params":[],"open_fields":false,"notes":[{"en":"Band midpoints in years, SRP31.96 Table 3: ON 0.0028, ON-1M 0.0417, 1M-3M 0.1667, 3M-6M 0.375, 6M-9M 0.625, 9M-1Y 0.875, 1Y-1.5Y 1.25, 1.5Y-2Y 1.75, 2Y-3Y 2.5, 3Y-4Y 3.5, 4Y-5Y 4.5, 5Y-6Y 5.5, 6Y-7Y 6.5, 7Y-8Y 7.5, 8Y-9Y 8.5, 9Y-10Y 9.5, 10Y-15Y 12.5, 15Y-20Y 17.5, 20Y+ 25.","es":"Puntos medios de las bandas en años, SRP31.96 Tabla 3: ON 0,0028, ON-1M 0,0417, 1M-3M 0,1667, 3M-6M 0,375, 6M-9M 0,625, 9M-1Y 0,875, 1Y-1.5Y 1,25, 1.5Y-2Y 1,75, 2Y-3Y 2,5, 3Y-4Y 3,5, 4Y-5Y 4,5, 5Y-6Y 5,5, 6Y-7Y 6,5, 7Y-8Y 7,5, 8Y-9Y 8,5, 9Y-10Y 9,5, 10Y-15Y 12,5, 15Y-20Y 17,5, 20Y+ 25,0."},{"en":"Liquidity items add four optional fields: liquidity_class (the HQLA level or non_hqla), residual_days, insured (a deposit) and fair_value beside amount; a record without them validates as before.","es":"Las partidas de liquidez agregan cuatro campos opcionales: liquidity_class, residual_days, insured y fair_value junto a amount; un registro sin ellos valida como antes."}],"param_checks":[]}