{"schema":"contraste.contract/v1","family":"market_series","title":{"en":"Market series","es":"Serie de mercado"},"used_by":{"en":"VaR and ES, backtests and stress windows: one row per series and date.","es":"VaR y ES, pruebas retrospectivas y ventanas de estrés: una fila por serie y fecha."},"fields":[{"name":"date","kind":"date","meaning":{"en":"Observation date","es":"Fecha de observación"},"unit":"","lo":null,"hi":null,"lo_open":false,"hi_open":false,"values":[],"values_param":null,"required":true,"on_missing":"reject","expected":"an ISO date YYYY-MM-DD"},{"name":"series_id","kind":"str","meaning":{"en":"Series identifier","es":"Identificador de la serie"},"unit":"","lo":null,"hi":null,"lo_open":false,"hi_open":false,"values":[],"values_param":null,"required":true,"on_missing":"reject","expected":"a non-empty text"},{"name":"value","kind":"float","meaning":{"en":"Observed value, in the declared unit","es":"Valor observado, en la unidad declarada"},"unit":"","lo":null,"hi":null,"lo_open":false,"hi_open":false,"values":[],"values_param":null,"required":true,"on_missing":"reject","expected":"a finite number in (-inf, +inf)"},{"name":"unit","kind":"enum","meaning":{"en":"Unit: a simple or log return, a level, or a rate in decimal","es":"Unidad: un retorno simple o logarítmico, un nivel, o una tasa en decimal"},"unit":"","lo":null,"hi":null,"lo_open":false,"hi_open":false,"values":["return","log_return","level","rate"],"values_param":null,"required":true,"on_missing":"reject","expected":"one of {return, log_return, level, rate}"}],"rules":[{"id":"MS-UNIQUE","scope":"group","policy":"reject","field":"date","statement":{"en":"One value per series and date.","es":"Un valor por serie y fecha."},"group_by":["series_id","date"],"order_by":null},{"id":"MS-GAP","scope":"group","policy":"flag","field":"date","statement":{"en":"Consecutive observations are at most 5 business days apart.","es":"Las observaciones consecutivas distan como máximo 5 días hábiles."},"group_by":["series_id"],"order_by":"date"}],"params":[],"open_fields":false,"notes":[{"en":"No value is forward-filled across a forecast date: a forecast for day t uses data up to t-1 only.","es":"Ningún valor se arrastra hacia adelante a través de una fecha de pronóstico: el pronóstico del día t usa datos hasta t-1."}],"param_checks":[]}