{"schema":"contraste.contract/v1","family":"scored_sample","title":{"en":"Scored sample","es":"Muestra puntuada"},"used_by":{"en":"Every PD and ML case: one row per obligor or account at its observation date.","es":"Todo caso de PD y de ML: una fila por deudor o cuenta en su fecha de observación."},"fields":[{"name":"id","kind":"str","meaning":{"en":"Obligor or account identifier","es":"Identificador del deudor o de la cuenta"},"unit":"","lo":null,"hi":null,"lo_open":false,"hi_open":false,"values":[],"values_param":null,"required":true,"on_missing":"reject","expected":"a non-empty text"},{"name":"observation_date","kind":"date","meaning":{"en":"Date at which the features are observed","es":"Fecha en que se observan las variables"},"unit":"","lo":null,"hi":null,"lo_open":false,"hi_open":false,"values":[],"values_param":null,"required":true,"on_missing":"reject","expected":"an ISO date YYYY-MM-DD"},{"name":"target","kind":"flag","meaning":{"en":"Default (1) or not (0) over the case's horizon","es":"Incumplimiento (1) o no (0) en el horizonte del caso"},"unit":"","lo":null,"hi":null,"lo_open":false,"hi_open":false,"values":[],"values_param":null,"required":true,"on_missing":"reject","expected":"0 or 1"},{"name":"decision","kind":"flag","meaning":{"en":"The lender's decision: 1 approval (HMDA action taken 1 or 2), 0 denial (action taken 3); a named convention, not a legal classification","es":"La decisión del prestamista: 1 aprobación (acción HMDA 1 o 2), 0 rechazo (acción 3); una convención con nombre, no una clasificación legal"},"unit":"","lo":null,"hi":null,"lo_open":false,"hi_open":false,"values":[],"values_param":null,"required":false,"on_missing":"reject","expected":"0 or 1"},{"name":"score","kind":"float","meaning":{"en":"Model score, in the units the case declares","es":"Puntaje del modelo, en las unidades que declara el caso"},"unit":"","lo":null,"hi":null,"lo_open":false,"hi_open":false,"values":[],"values_param":null,"required":false,"on_missing":"reject","expected":"a finite number in (-inf, +inf)"},{"name":"pd","kind":"float","meaning":{"en":"Probability of default","es":"Probabilidad de incumplimiento"},"unit":"probability","lo":0.0,"hi":1.0,"lo_open":true,"hi_open":true,"values":[],"values_param":null,"required":false,"on_missing":"reject","expected":"a finite number in (0, 1) (probability)"},{"name":"grade","kind":"enum","meaning":{"en":"Rating grade, from the declared scale","es":"Grado de calificación, de la escala declarada"},"unit":"","lo":null,"hi":null,"lo_open":false,"hi_open":false,"values":[],"values_param":"grades","required":false,"on_missing":"reject","expected":"one of the values of parameter 'grades'"},{"name":"segment","kind":"str","meaning":{"en":"Segment for the per-segment tests","es":"Segmento para las pruebas por segmento"},"unit":"","lo":null,"hi":null,"lo_open":false,"hi_open":false,"values":[],"values_param":null,"required":false,"on_missing":"reject","expected":"a non-empty text"},{"name":"protected_attr","kind":"str","meaning":{"en":"Protected attribute, for the fairness tests only; never a model input","es":"Atributo protegido, solo para las pruebas de equidad; nunca una entrada del modelo"},"unit":"","lo":null,"hi":null,"lo_open":false,"hi_open":false,"values":[],"values_param":null,"required":false,"on_missing":"reject","expected":"a non-empty text"}],"rules":[{"id":"SS-UNIQUE","scope":"group","policy":"reject","field":"id","statement":{"en":"Each identifier appears once per observation date.","es":"Cada identificador aparece una vez por fecha de observación."},"group_by":["id","observation_date"],"order_by":null},{"id":"SS-POPULATION-NO-OUTCOME","scope":"record","policy":"reject","field":"target","statement":{"en":"A population sample carries neither an outcome nor a decision; its role is a shift probe.","es":"Una muestra de población no lleva ni resultado ni decisión; su papel es el de una sonda de desplazamiento."},"group_by":[],"order_by":null}],"params":[{"name":"grades","kind":"list","meaning":{"en":"The grade scale, best to worst","es":"La escala de grados, de mejor a peor"},"required":false,"values":[]},{"name":"outcome","kind":"enum","meaning":{"en":"Whether the case declares an outcome: target (default, required), none (a decision sample such as HMDA: target becomes optional and decision becomes required) or population (a population sample such as the Fed portfolios, a shift probe: target and decision are optional and a row that carries either is rejected)","es":"Si el caso declara un resultado: target (por defecto, obligatorio), none (una muestra de decisiones como HMDA: target pasa a ser opcional y decision pasa a ser obligatorio) o population (una muestra de población como las carteras de la Fed, una sonda de desplazamiento: target y decision son opcionales y se rechaza la fila que lleve alguno)"},"required":false,"values":["target","none","population"]}],"open_fields":true,"notes":[{"en":"A case that declares no outcome sets the dataset parameter outcome to none; target is then optional and the decision field becomes required and carries the lender's decision. Several protected attributes are the case's declared open fields.","es":"Un caso que no declara resultado fija el parametro outcome en none; target pasa a ser opcional y el campo decision pasa a ser obligatorio y lleva la decision del prestamista. Varios atributos protegidos son campos abiertos declarados por el caso."},{"en":"A case whose data carries loan or obligor variables only, with neither an outcome nor a decision (the Federal Reserve hypothetical portfolios of C20), sets the dataset parameter outcome to population: its role is a shift probe, target and decision are optional and a row that carries either is rejected by SS-POPULATION-NO-OUTCOME. A population sample is never validated as a scored one.","es":"Un caso cuyos datos llevan solo variables de préstamo o de deudor, sin resultado ni decisión (las carteras hipotéticas de la Reserva Federal de C20), fija el parámetro outcome en population: su papel es el de una sonda de desplazamiento, target y decision son opcionales y la regla SS-POPULATION-NO-OUTCOME rechaza la fila que lleve alguno. Una muestra de población nunca se valida como una puntuada."},{"en":"Public HMDA withholds the loan identifier and the application and action dates (U14 research addendum H1 2.5), so its reader writes two named conventions: id is the row position in the source file within its activity year, written <activity_year>-<row>, and observation_date is the activity year's 12-31, written <activity_year>-12-31. Both are conventions, not source values.","es":"El HMDA publico omite el identificador del prestamo y las fechas de solicitud y de accion (adendum de investigacion U14 H1 2.5), de modo que su lector escribe dos convenciones con nombre: id es la posicion de la fila en el archivo fuente dentro de su ano de actividad, escrita <activity_year>-<row>, y observation_date es el 12-31 del ano de actividad, escrita <activity_year>-12-31. Ambas son convenciones, no valores de la fuente."},{"en":"The case declares its features with their units; a missing feature is flagged, and imputation is fitted on the training slice only.","es":"El caso declara sus variables con sus unidades; una variable faltante se marca, y la imputación se ajusta solo con el tramo de entrenamiento."}],"param_checks":[]}