{"schema":"contraste.contract/v1","family":"rating_history","title":{"en":"Rating history","es":"Historia de calificaciones"},"used_by":{"en":"Transition matrices, default rates by grade and TTC calibration.","es":"Matrices de transición, tasas de incumplimiento por grado y calibración TTC."},"fields":[{"name":"obligor_id","kind":"str","meaning":{"en":"Obligor identifier","es":"Identificador del deudor"},"unit":"","lo":null,"hi":null,"lo_open":false,"hi_open":false,"values":[],"values_param":null,"required":true,"on_missing":"reject","expected":"a non-empty text"},{"name":"date","kind":"date","meaning":{"en":"Date of the rating","es":"Fecha de la calificación"},"unit":"","lo":null,"hi":null,"lo_open":false,"hi_open":false,"values":[],"values_param":null,"required":true,"on_missing":"reject","expected":"an ISO date YYYY-MM-DD"},{"name":"grade","kind":"enum","meaning":{"en":"Grade from the declared scale, the default grade D, or WR (withdrawn)","es":"Grado de la escala declarada, el grado de incumplimiento D, o WR (retirada)"},"unit":"","lo":null,"hi":null,"lo_open":false,"hi_open":false,"values":["WR"],"values_param":"grades","required":true,"on_missing":"reject","expected":"one of {WR}"}],"rules":[{"id":"RH-WR-EXCLUDE","scope":"record","policy":"exclude","field":"grade","statement":{"en":"Under the exclude convention a withdrawn rating is removed and counted.","es":"Con la convención de exclusión, una calificación retirada se elimina y se cuenta."},"group_by":[],"order_by":null},{"id":"RH-WR-CENSOR","scope":"record","policy":"flag","field":"grade","statement":{"en":"Under the censor convention a withdrawn rating censors the obligor at that date, and is counted.","es":"Con la convención de censura, una calificación retirada censura al deudor en esa fecha, y se cuenta."},"group_by":[],"order_by":null},{"id":"RH-UNIQUE","scope":"group","policy":"reject","field":"date","statement":{"en":"One rating per obligor and date.","es":"Una calificación por deudor y fecha."},"group_by":["obligor_id","date"],"order_by":null}],"params":[{"name":"grades","kind":"list","meaning":{"en":"The grade scale, best to worst, including D","es":"La escala de grados, de mejor a peor, con D"},"required":true,"values":[]},{"name":"wr_convention","kind":"enum","meaning":{"en":"How a withdrawn rating is handled","es":"Cómo se trata una calificación retirada"},"required":true,"values":["exclude","censor","state"]}],"open_fields":false,"notes":[],"param_checks":[{"en":"The declared grade scale includes the default grade D, does not list WR, and repeats no grade.","es":"La escala de grados declarada incluye el grado de incumplimiento D, no incluye WR y no repite grados."}]}