{"schema":"contraste.contract/v1","family":"loss_events","title":{"en":"Operational loss events","es":"Eventos de pérdida operacional"},"used_by":{"en":"Operational risk LDA and SMA: one row per loss event.","es":"LDA y SMA de riesgo operacional: una fila por evento de pérdida."},"fields":[{"name":"event_id","kind":"str","meaning":{"en":"Event identifier","es":"Identificador del evento"},"unit":"","lo":null,"hi":null,"lo_open":false,"hi_open":false,"values":[],"values_param":null,"required":true,"on_missing":"reject","expected":"a non-empty text"},{"name":"date","kind":"date","meaning":{"en":"Accounting date of the loss (OPE25.19)","es":"Fecha contable de la pérdida (OPE25.19)"},"unit":"","lo":null,"hi":null,"lo_open":false,"hi_open":false,"values":[],"values_param":null,"required":true,"on_missing":"reject","expected":"an ISO date YYYY-MM-DD"},{"name":"business_line","kind":"str","meaning":{"en":"Business line, from the case's vocabulary","es":"Línea de negocio, del vocabulario del caso"},"unit":"","lo":null,"hi":null,"lo_open":false,"hi_open":false,"values":[],"values_param":null,"required":true,"on_missing":"reject","expected":"a non-empty text"},{"name":"event_type","kind":"enum","meaning":{"en":"Level 1 event type (OPE25.17 Table 2)","es":"Tipo de evento de nivel 1 (OPE25.17 Tabla 2)"},"unit":"","lo":null,"hi":null,"lo_open":false,"hi_open":false,"values":["internal_fraud","external_fraud","employment_practices_and_workplace_safety","clients_products_and_business_practices","damage_to_physical_assets","business_disruption_and_system_failures","execution_delivery_and_process_management"],"values_param":null,"required":true,"on_missing":"reject","expected":"one of {internal_fraud, external_fraud, employment_practices_and_workplace_safety, clients_products_and_business_practices, damage_to_physical_assets, business_disruption_and_system_failures, execution_delivery_and_process_management}"},{"name":"gross_loss","kind":"float","meaning":{"en":"Gross loss","es":"Pérdida bruta"},"unit":"currency","lo":0.0,"hi":null,"lo_open":true,"hi_open":false,"values":[],"values_param":null,"required":true,"on_missing":"reject","expected":"a finite number in (0, +inf) (currency)"},{"name":"recovery","kind":"float","meaning":{"en":"Recovery","es":"Recupero"},"unit":"currency","lo":0.0,"hi":null,"lo_open":false,"hi_open":false,"values":[],"values_param":null,"required":false,"on_missing":"reject","expected":"a finite number in [0, +inf) (currency)"}],"rules":[{"id":"LE-THRESHOLD","scope":"record","policy":"reject","field":"gross_loss","statement":{"en":"A loss is at or above the collection threshold; truncation is modelled, not silently kept.","es":"Una pérdida está en o sobre el umbral de recolección; el truncamiento se modela, no se oculta."},"group_by":[],"order_by":null},{"id":"LE-RECOVERY","scope":"record","policy":"flag","field":"recovery","statement":{"en":"A recovery does not exceed its gross loss.","es":"Un recupero no supera su pérdida bruta."},"group_by":[],"order_by":null},{"id":"LE-UNIQUE","scope":"group","policy":"reject","field":"event_id","statement":{"en":"Each event appears once.","es":"Cada evento aparece una vez."},"group_by":["event_id"],"order_by":null}],"params":[{"name":"collection_threshold","kind":"float","meaning":{"en":"Loss collection threshold (OPE25.18: EUR 20,000)","es":"Umbral de recolección de pérdidas (OPE25.18: EUR 20.000)"},"required":true,"values":[]},{"name":"currency","kind":"enum","meaning":{"en":"Currency of the amounts","es":"Moneda de los montos"},"required":true,"values":["USD","CLP","CLF","EUR"]}],"open_fields":false,"notes":[],"param_checks":[]}